No.,ID Pemasok,Nama,Kontak,No. Telp. Bisnis,Handphone,Email,Alamat,Kota,Provinsi,Negara,Kode Pos,Catatan,Hutang,Uang muka,NPWP,NIK,Nama Wajib Pajak
1,SUPP001,ANEKA PEMBELI ULI SUKABUMI,,,,,,,,,,,,,,,ANEKA PEMBELI ULI SUKABUMI
2,SUPP002,CV SAMUDRA JAYA ABADI,,,,,,,,,,,,,,,CV SAMUDRA JAYA ABADI
3,SUPP003,ELLEE KARUNIA SEJAHTERA,,,,,,,,,,,,,,,ELLEE KARUNIA SEJAHTERA
4,SUPP004,FMT MAXX BOX,,,,,,,,,,,,,,,FMT MAXX BOX
5,SUPP005,KUDO TEKNOLOGI INDONESIA,,,,,,,,,,,,,,,KUDO TEKNOLOGI INDONESIA
6,SUPP006,LIEFAREL MULTINIAGA LEST,,,,,,,,,,,,,,,LIEFAREL MULTINIAGA LEST
7,SUPP007,PANGAN SEJAHTERA SANTOSA,,,,,,,,,,,,,,,PANGAN SEJAHTERA SANTOSA
8,SUPP008,PT ASIA TRITUNGGAL JAYA,,,,,,,,,,,,,,,PT ASIA TRITUNGGAL JAYA
9,SUPP009,PT GLOBAL DIGITAL NIAGA,,,,,,,,,,,,,,,PT GLOBAL DIGITAL NIAGA
10,SUPP010,PT HERO RETAIL NUSANTARA,,,,,,,,,,,,,,,PT HERO RETAIL NUSANTARA
11,SUPP011,PT INTI CAKRAWALA CITRA,,,,,,,,,,,,,,,INDOGROSIR CIKOKOL
12,SUPP012,PT KHARISMA SUKSES MAJU,,,,,,,,,,,,,,,PT KHARISMA SUKSES MAJU
13,SUPP013,PT LOTTE MART INDONESIA,,,,,,,,,,,,,,,PT LOTTE MART INDONESIA
14,SUPP014,PT LOTTE SHOPPING INDONESIA,,,,,,,,,,,,,,,PT LOTTE SHOPPING INDONESIA
15,SUPP015,PT LULU GROUP RETAIL,,,,,,,,,,,,,,,PT LULU GROUP RETAIL
16,SUPP016,PT MATAHARI PUTRA PRIMA,,,,,,,,,,,,,,,PT MATAHARI PUTRA PRIMA
17,SUPP017,PT MIDI UTAMA INDONESIA,,,,,,,,,,,,,,,PT MIDI UTAMA INDONESIA
18,SUPP018,PT MITRA JAYAPERSADA,,,,,,,,,,,,,,,PT MITRA JAYAPERSADA
19,SUPP019,PT PANJUNAN,,,,,,,,,,,,,,,PT PANJUNAN
20,SUPP020,PT PD TEMPO,,,,,,,,,,,,,,,PT PD TEMPO
21,SUPP021,PT PRIMA KARYA LAKSANA UTAMA,,,,,,,,,,,,,,,PT PRIMA KARYA LAKSANA UTAMA
22,SUPP022,PT PUTERA MAKMUR TRADING,,,,,,,,,,,,,,,PT PUTERA MAKMUR TRADING
23,SUPP023,PT SAYAP MAS UTAMA,,,,,,,,,,,,,,,PT SAYAP MAS UTAMA
24,SUPP024,PT SEKAR WANGI ADA PERKASA,,,,,,,,,,,,,,,PT SEKAR WANGI ADA PERKASA
25,SUPP025,PT SELATAN JAYA MAKMUR,,,,,,,,,,,,,,,PT SELATAN JAYA MAKMUR
26,SUPP026,PT SUMBER SAKTI SEJAHTERA,,,,,,,,,,,,,,,PT SUMBER SAKTI SEJAHTERA
27,SUPP027,PT SUPRA BOGA LESTARI,,,,,,,,,,,,,,,PT SUPRA BOGA LESTARI
28,SUPP028,PT SURYA DONASIN,,,,,,,,,,,,,,,PT SURYA DONASIN
29,SUPP029,PT SURYA GRAHA PASARAYA,,,,,,,,,,,,,,,PT SURYA GRAHA PASARAYA
30,SUPP030,PT SURYA RITELINDO UTAMA,,,,,,,,,,,,,,,PT SURYA RITELINDO UTAMA
31,SUPP031,PT UNIRAMA DUTA NIAGA,,,,,,,,,,,,,,,PT UNIRAMA DUTA NIAGA
32,SUPP032,TREEDOTS GROUP INDONESIA,,,,,,,,,,,,,,,TREEDOTS GROUP INDONESIA
